{
  "id": "tool-round-trip",
  "kind": "loop",
  "scenario": "tool-round-trip",
  "description": "Model requests one tool call, the executor runs it and returns an observation, the observation is appended, then the model answers. stopReason=answer, iterations=2, trajectory=[user, assistant(tool-call), tool, assistant]. Tool call arguments are carried as a raw JSON string and never reshaped.",
  "source": {
    "tests": [
      "packages/agent/test/fixtures.test.ts"
    ],
    "docs": "docs/modules/agent-loop.md"
  },
  "input": {
    "sessionId": "tool-round-trip",
    "systemPrompt": "test system prompt",
    "userMessage": "hello",
    "history": [],
    "systemContext": null,
    "tools": [
      {
        "name": "echo",
        "description": "test tool",
        "parameters": {
          "type": "object",
          "properties": {}
        }
      }
    ],
    "contextTokenBudget": null,
    "maxIterations": 8,
    "maxTokens": null,
    "reasoningEffort": null,
    "finalOutputTool": null,
    "model": {
      "responses": [
        {
          "text": "need data",
          "toolCalls": [
            {
              "id": "call_1",
              "name": "echo",
              "arguments": "{\"x\":1}"
            }
          ],
          "finishReason": "tool-calls",
          "failure": null,
          "usage": {
            "inputTokens": 0,
            "outputTokens": 0
          },
          "cost": null,
          "model": "fake"
        },
        {
          "text": "done",
          "toolCalls": [],
          "finishReason": "stop",
          "failure": null,
          "usage": {
            "inputTokens": 0,
            "outputTokens": 0
          },
          "cost": null,
          "model": "fake"
        }
      ]
    }
  },
  "expected": {
    "stopReason": "answer",
    "answer": "done",
    "iterations": 2,
    "usage": {
      "inputTokens": 0,
      "outputTokens": 0
    },
    "cost": null,
    "failure": null,
    "modelRequestCount": 2,
    "eventSequence": [
      "turnCompleted",
      "toolStarted",
      "toolCompleted",
      "turnCompleted"
    ],
    "toolCalls": [
      {
        "id": "call_1",
        "name": "echo",
        "arguments": "{\"x\":1}",
        "observation": "result for echo",
        "isError": false
      }
    ],
    "trajectoryCount": 4,
    "trajectory": [
      {
        "role": "user",
        "content": [
          {
            "type": "text",
            "text": "hello"
          }
        ]
      },
      {
        "role": "assistant",
        "content": [
          {
            "type": "text",
            "text": "need data"
          },
          {
            "type": "tool-call",
            "id": "call_1",
            "name": "echo",
            "arguments": "{\"x\":1}"
          }
        ]
      },
      {
        "role": "tool",
        "toolCallId": "call_1",
        "content": "result for echo",
        "isError": false
      },
      {
        "role": "assistant",
        "content": [
          {
            "type": "text",
            "text": "done"
          }
        ]
      }
    ]
  }
}
